<?xml version='1.0'?>
<!DOCTYPE class SYSTEM "tech_ref.dtd">
<class name="xbkFileExplorer" version="1.0" since="1.0">
<desc>
<![CDATA[
The xbkFileExplorer class provide a file explorer.
]]>
</desc>
<fields>
</fields>
<constructor>
<method name="xbkFileExplorer" comment="" >
<method_desc>  </method_desc>
<params>
<param name="inst" typename="String" comment="The name or id to be use for this xbkFileExplorer." />
<param name="parent" typename="xbkLayer" comment="The parent of the xbkFileExplorer object if it has one." />
</params>
</method>
</constructor>
<methods>
<method name="getParentNode" comment="" >
<method_desc>
<![CDATA[
Creates a parent xbkTreeNode Folder and return it.
]]>
</method_desc>
<params>
<param name="text" typename="String" comment="Text that appears for the item." />
<param name="fHandler" typename="Reference" comment="Reference to a handler function for this xbkTreeNode." />
<param name="closeImg" typename="String" comment="Image to use for folder close." />
<param name="openImg" typename="String" comment="Image to use for folder open." />
</params>
<return typename="xbkTreeNode" comment="Reference to a xbkTreeNode note: see xbkTreeNode class" ></return>
</method>
<method name="getChildNode" comment="" >
<method_desc>
<![CDATA[
Creates a child xbkTreeNode and return it.
]]>
</method_desc>
<params>
<param name="text" typename="String" comment="Text that appears for the item." />
<param name="fHandler" typename="Reference" comment="Reference to a handler function for this xbkTreeNode." />
<param name="img" typename="String" comment="Image to use." />
</params>
<return typename="xbkTreeNode" comment="Reference to a xbkTreeNode note: see xbkTreeNode class" ></return>
</method>
<method name="removeSelectedItem" comment="" >
<method_desc>
<![CDATA[
Remove the selected item.
]]>
</method_desc>
<params>
</params>
<return typename="None" comment="" ></return>
</method>
</methods>
<related>
</related>
<examples>
<example url="pathToExampleFile" title="exampleTitle" comment="exampleComment" />
</examples>
<extends name="xbkLayer" />
</class>
