<?xml version='1.0'?>
<!DOCTYPE class SYSTEM "tech_ref.dtd">
<class name="xbkToolBar" version="1.0" since="1.0">
<desc>
<![CDATA[
The xbkToolBar class provides a horizontal or vertical tool bar system.
]]>
</desc>
<fields>
</fields>
<constructor>
<method name="xbkToolBar" comment="" >
<method_desc>  </method_desc>
<params>
<param name="inst" typename="String" comment="The name or id to be use for this xbkToolBar." />
<param name="parent" typename="xbkLayer" comment="The parent of the xbkToolBar object if it has one." />
</params>
</method>
</constructor>
<methods>
<method name="autostrechHorizontal" comment="" >
<method_desc>
<![CDATA[
Autostrech horizontal.
]]>
</method_desc>
<params>
<param name="bType" typename="Boolean" comment="Set to true or false." />
</params>
<return typename="None" comment="" ></return>
</method>
<method name="autostrechVertical" comment="" >
<method_desc>
<![CDATA[
Autostrech vertical.
]]>
</method_desc>
<params>
<param name="bType" typename="Boolean" comment="Set to true or false." />
</params>
<return typename="None" comment="" ></return>
</method>
<method name="setHorizontalToolBar" comment="" >
<method_desc>
<![CDATA[
Set Tool bar to be horizontal or vertical, default is horizontal.
]]>
</method_desc>
<params>
<param name="bType" typename="Boolean" comment="Set to true or false." />
</params>
<return typename="None" comment="" ></return>
</method>
<method name="addItem" comment="" >
<method_desc>
<![CDATA[
Adds an item to the Menu.
]]>
</method_desc>
<params>
<param name="img" typename="String" comment="Image to use." />
<param name="imgOver" typename="String" comment="Image for mouseover event." />
<param name="imgDown" typename="String" comment="Image for onclick event." />
<param name="fHandler" typename="Reference" comment="Referece to a handler function." />
</params>
<return typename="None" comment="" ></return>
</method>
<method name="removeItem" comment="" >
<method_desc>
<![CDATA[
Remove a item from the xbkToolBar
]]>
</method_desc>
<params>
<param name="index" typename="Number" comment="The index of the xbkToolBar to be remove." />
</params>
<return typename="None" comment="" ></return>
</method>
<method name="draw" comment="" >
<method_desc>
<![CDATA[
Draw the xbkToolBar
]]>
</method_desc>
<params>
</params>
<return typename="None" comment="" ></return>
</method>
</methods>
<related>
</related>
<examples>
</examples>
<extends name="xbkLayer" />
</class>
