<?xml version='1.0'?>
<!DOCTYPE class SYSTEM "tech_ref.dtd">
<class name="xbkDragAndDrop" version="1.0" since="1.0">
<desc>
<![CDATA[
This xbkDragAndDrop class handles the drag and drop event for the xbkAPI Class Object.
]]>
</desc>
<fields>
</fields>
<constructor>
<method name="xbkDragAndDrop" comment="" >
<method_desc>  </method_desc>
<params>
</params>
</method>
</constructor>
<methods>
<method name="setDragIconBgColor" comment="" >
<method_desc>
<![CDATA[
Set the icon drag background color.
]]>
</method_desc>
<params>
<param name="sColor" typename="String" comment="color to be use." />
</params>
<return typename="None" comment="" ></return>
</method>
<method name="setUseImageAsDragIcon" comment="" >
<method_desc>
<![CDATA[
Use the image as the drag icon.
]]>
</method_desc>
<params>
<param name="bSet" typename="Boolean" comment="" />
</params>
<return typename="None" comment="" ></return>
</method>
<method name="setSelectItem" comment="" >
<method_desc>
<![CDATA[
Set the select item.
]]>
</method_desc>
<params>
<param name="node" typename="Variant" comment="" />
</params>
<return typename="None" comment="" ></return>
</method>
</methods>
<related>
</related>
<examples>
<example url="pathToExampleFile" title="exampleTitle" comment="exampleComment" />
</examples>
<extends name="xbkObject" />
</class>
