<?xml version='1.0'?>
<!DOCTYPE class SYSTEM "tech_ref.dtd">
<class name="xbkPopupMenu" version="1.0" since="1.0">
<desc>
<![CDATA[
The xbkPopupMenu class provides a menu system.
]]>
</desc>
<fields>
</fields>
<constructor>
<method name="xbkPopupMenu" comment="" >
<method_desc>  </method_desc>
<params>
<param name="parent" typename="xbkLayer" comment="The parent of the xbkPopupMenu object if it has one." />
</params>
</method>
</constructor>
<methods>
<method name="addItem" comment="" >
<method_desc>
<![CDATA[
Adds an item to the Menu.
]]>
</method_desc>
<params>
<param name="text" typename="String" comment="Text that appears for the item." />
<param name="fHandler" typename="Reference" comment="Referece to a handler function." />
</params>
<return typename="Nothing" comment="" ></return>
</method>
<method name="addBar" comment="" >
<method_desc>
<![CDATA[
Adds a separator to divide groups of menu commands.
]]>
</method_desc>
<params>
</params>
<return typename="Nothing" comment="" ></return>
</method>
</methods>
<related>
</related>
<examples>
</examples>
<extends name="xbkLayer" />
</class>
