<?xml version='1.0'?>
<!DOCTYPE class SYSTEM "tech_ref.dtd">
<class name="xbkLabel" version="1.0" since="1.0">
<desc>
<![CDATA[
The xbkLabel class provides simple labels for any xbkAPI web applications.
]]>
</desc>
<fields>
</fields>
<constructor>
<method name="xbkLabel" comment="" >
<method_desc>  </method_desc>
<params>
<param name="inst" typename="String" comment="The name or id to be use for this xbkLabel." />
<param name="parent" typename="xbkLayer" comment="The parent of the xbkLabel object if it has one." />
</params>
</method>
</constructor>
<methods>
<method name="setTextAlign" comment="" >
<method_desc>
<![CDATA[
Set the text align.
]]>
</method_desc>
<params>
<param name="text" typename="String" comment="" />
</params>
<return typename="None" comment="" ></return>
</method>
<method name="setText" comment="" >
<method_desc>
<![CDATA[
Set the text for the xbkLabel.
]]>
</method_desc>
<params>
<param name="text" typename="String" comment="" />
</params>
<return typename="None" comment="" ></return>
</method>
<method name="setStyle" comment="" >
<method_desc>
<![CDATA[
Set the CSS style.
]]>
</method_desc>
<params>
<param name="sStyle" typename="String" comment="Class style name." />
</params>
<return typename="None" comment="" ></return>
</method>
</methods>
<related>
</related>
<examples>
</examples>
<extends name="xbkLayer" />
</class>
