<?xml version='1.0'?>
<!DOCTYPE class SYSTEM "tech_ref.dtd">
<class name="xbkList" version="1.0" since="1.0">
<desc>
<![CDATA[
The xbkList class display information in a list type system.
]]>
</desc>
<fields>
</fields>
<constructor>
<method name="xbkList" comment="" >
<method_desc>  </method_desc>
<params>
<param name="inst" typename="String" comment="The name or id to be use for this xbkList." />
<param name="parent" typename="xbkLayer" comment="The parent of the xbkList object." />
</params>
</method>
</constructor>
<methods>
<method name="setSelectedColor" comment="" >
<method_desc>
<![CDATA[
Set the background color of the selected row.
]]>
</method_desc>
<params>
<param name="color" typename="String" comment="The color to use." />
</params>
<return typename="None" comment="" ></return>
</method>
<method name="aHeading" comment="" >
<method_desc>
<![CDATA[
Set the heading of the xbkList.
]]>
</method_desc>
<params>
<param name="aHeading" typename="Array" comment="The heading to be use." />
</params>
<return typename="None" comment="" ></return>
</method>
<method name="addRow" comment="" >
<method_desc>
<![CDATA[
Set a row to the xbkList.
]]>
</method_desc>
<params>
<param name="id" typename="String" comment="A unique id for the row." />
<param name="aRow" typename="Array" comment="The row html string." />
<param name="fhandler" typename="Reference" comment="A reference to a function handler for the row." />
</params>
<return typename="None" comment="" ></return>
</method>
<method name="removeRow" comment="" >
<method_desc>
<![CDATA[
Remove the row by id.
]]>
</method_desc>
<params>
<param name="id" typename="String" comment="A unique id for the row." />
</params>
<return typename="None" comment="" ></return>
</method>
</methods>
<related>
</related>
<examples>
<example url="pathToExampleFile" title="exampleTitle" comment="exampleComment" />
</examples>
<extends name="xbkLayer" />
</class>
