<?xml version='1.0'?>
<!DOCTYPE class SYSTEM "tech_ref.dtd">
<class name="xbkIconBrowser" version="2.1" since="1.0">
<desc>
<![CDATA[
The xbkIconBrowser Class creates a file view like look and feel tool for any xbkAPI web applications.
]]>
</desc>
<fields>
</fields>
<constructor>
<method name="xbkIconView" comment="" >
<method_desc>  </method_desc>
<params>
<param name="inst" typename="String" comment="The name or id to be use for this xbkIconBrowser." />
<param name="parent" typename="xbkLayer" comment="The parent of the xbkIconBrowser object if it has one." />
</params>
</method>
</constructor>
<methods>
<method name="removeALL" comment="" >
<method_desc>
<![CDATA[
Remove all.
]]>
</method_desc>
<params>
</params>
<return typename="None" comment="" ></return>
</method>
<method name="setHighLightColor" comment="" >
<method_desc>
<![CDATA[
Set the highlight selected color.
]]>
</method_desc>
<params>
<param name="color" typename="String" comment="Color to be use." />
</params>
<return typename="None" comment="" ></return>
</method>
<method name="addItem" comment="" >
<method_desc>
<![CDATA[
Adds an icon to the xbkIconBrowser.
]]>
</method_desc>
<params>
<param name="id" typename="String" comment="icon id." />
<param name="text" typename="String" comment="Display name of the icon." />
<param name="img" typename="URL" comment="of the icon image to display." />
<param name="fHandler" typename="Reference" comment="A Function handler to be use by this icon." />
</params>
<return typename="Nothing" comment="" ></return>
</method>
<method name="getSelectedId" comment="" >
<method_desc>
<![CDATA[
Returns the id of the icon currently selected, null if none.
]]>
</method_desc>
<params>
</params>
<return typename="String" comment="" ></return>
</method>
<method name="removeItem" comment="" >
<method_desc>
<![CDATA[
Remove an item from the xbkIconBrowser.
]]>
</method_desc>
<params>
<param name="id" typename="String" comment="id of the icon to remove." />
</params>
<return typename="None" comment="" ></return>
</method>
<method name="sort" comment="" >
<method_desc>
<![CDATA[
Organizes all in descending alphabetical order by name.
]]>
</method_desc>
<params>
</params>
<return typename="None" comment="" ></return>
</method>
<method name="selectIconById" comment="" >
<method_desc>
<![CDATA[
Select an item from the xbkIconBrowser.
]]>
</method_desc>
<params>
<param name="id" typename="String" comment="id of the icon to select." />
</params>
<return typename="None" comment="" ></return>
</method>
</methods>
<related>
</related>
<examples>
<example url="pathToExampleFile" title="exampleTitle" comment="exampleComment" />
</examples>
<extends name="xbkLayer" />
</class>
